"bookmark_count","conversation_id_str","created_at","display_name","favorite_count","full_text","id_str","image_url","in_reply_to_screen_name","lang","like_count","location","quote_count","reply_count","retweet_count","tweet_url","user_id_str","username","views_count"
"20","1984263963203526930","Fri Oct 31 14:19:29 +0000 2025",,"301","Kontingen Indonesia sukses meraih juara 1 Parade Keragaman Budaya (Cultural Diversity Parade) dalam ajang Migrants Arirang Multicultural Festival (MAMF) 2025 di Changwon Provinsi Gyeongnam Korea Selatan. : MAMF 2025 via YouTube Indonesia tampil dengan mengusung tema https://t.co/jH1MeBBdz6","1984263963203526930","https://pbs.twimg.com/amplify_video_thumb/1984261551742947329/img/SaZBCJOdwzhXnO5w.jpg","","in","301","","1","6","81","https://x.com/undefined/status/1984263963203526930","39677695",,"7080"
"0","1987078920982962240","Sat Nov 08 08:45:07 +0000 2025",,"10","Joki Tugas Open Selalu Bahasa Sunda Tulis Studi Kasus Parafrase PPT CV Matematika Ketik Geografi Pidato Cerpen TIK Kewirausahaan CV Analisis Film PJOK Pantun Essay Essai Beasiswa Ospek Laporan PKN Pancasila Review Jurnal SBK Seni Budaya Puisi Ketik https://t.co/nbXL1tde42","1987078920982962240","https://pbs.twimg.com/media/G5OFvxvbkAAodJq.jpg","","in","10","","0","0","3","https://x.com/undefined/status/1987078920982962240","1427851863198605318",,"252"
"4","1986231118908252633","Thu Nov 06 00:36:15 +0000 2025",,"14","Cuma mau ingetin Pangku (2025) tayang di bioskop dan ini jadi film yang wajib banget! Film yang menyoroti perjuangan seorang ibu di Pantura budaya Kopi Pangku dan hukuman sosial yang tak kasat mata atas ketidakberdayaan ekonomi dan gener. Tema yang relevan karena banyak orang https://t.co/zsc953rPtQ","1986231118908252633","https://pbs.twimg.com/media/G5CCnnXbkAAq0pY.jpg","","in","14","","0","0","0","https://x.com/undefined/status/1986231118908252633","1165741611227041792",,"2612"
"0","1987115427072483656","Sat Nov 08 11:10:11 +0000 2025",,"10","Open Jasa Joki Tugas Tulis Parafrase MindMap Puisi Ketik Geografi Pidato Cerpen CV PJOK Pantun Essay Essai Ospek Studi Kasus Translate Laporan Matematika Sosiologi PKN Pancasila Bahasa Sunda Review Jurnal SBK Seni Budaya Studi Kasus #jokitugas https://t.co/IRVbnODdKZ","1987115427072483656","https://pbs.twimg.com/media/G5Om8wEbgAEEYlH.jpg","","in","10","","0","0","3","https://x.com/undefined/status/1987115427072483656","1427851863198605318",,"302"
"2","1987681147497918805","Mon Nov 10 00:38:09 +0000 2025",,"35","Bapak Pembangunan Smiling General Suka atau tidak dia pernah memimpin di negeri ini dan Indonesia menjadi negara macan asia Suka atau tidak stabilitas tercapai saat itu baik bidang politik ekonomi dan sosial budaya Suka atau tidak Pancasila menjadi satu2nya ideologi di negara https://t.co/orq61RIxai","1987681147497918805","https://pbs.twimg.com/ext_tw_video_thumb/1987681110646796288/pu/img/3HOWtjqbQu7L7O1-.jpg","","in","35","","3","8","16","https://x.com/undefined/status/1987681147497918805","1152447574411902977",,"1214"
"5","1984245455170257022","Fri Oct 31 13:05:56 +0000 2025",,"31","#yukierre one tweet au Halloween bukan budaya kita... https://t.co/JFwGGkCnAi","1984245455170257022","https://pbs.twimg.com/media/G4l0tXNagAAKlyj.jpg","","in","31","","3","3","3","https://x.com/undefined/status/1984245455170257022","1501907429331959812",,"1622"
"0","1988134563265343559","Tue Nov 11 06:39:52 +0000 2025",,"2","Para wanita yang tergabung dalam Gejog Lesung Sekar Sari itu tampil mengenakan busana lurik. Irama alu beradu dengan lesung yang dimainkan bersamaan terdengar harmonis.. Masbup @hamenang jaga kesenian dan budaya https://t.co/p2ykX0z4TZ https://t.co/25ErZqU0Cm","1988134563265343559","https://pbs.twimg.com/media/G5dF2W9bMAA1AyI.jpg","","in","2","","0","2","2","https://x.com/undefined/status/1988134563265343559","1218044256180301824",,"54"
"0","1987116962426785858","Sat Nov 08 11:16:17 +0000 2025",,"10","Open Jasa Joki Tugas Ospek Studi Kasus Translate Laporan Matematika Sosiologi PKN Pancasila Bahasa Sunda Tulis Parafrase MindMap Puisi Ketik Geografi Pidato Cerpen CV PJOK Pantun Essay Essai Review Jurnal SBK Seni Budaya Studi Kasus #jokitugas https://t.co/oMfzQ2Elrc","1987116962426785858","https://pbs.twimg.com/media/G5OoWJ1bUAAoNX9.jpg","","in","10","","0","0","3","https://x.com/undefined/status/1987116962426785858","1427851863198605318",,"576"
